{
  "event_id":"dre-002",
  "observed_at":"2026-09-28T02:01:00Z",
  "condition":{"condition_id":"c-release-002","proposition":"Required scoped authority has not been established for external release.","state":"unresolved","established_at":"2026-09-28T02:00:00Z"},
  "transition_basis":{"primary_category":"none","changed_dimensions":[],"authority_changed":false,"evidence_refs":[],"rationale":"A peer instruction does not change authority, evidence, policy, or lifecycle state."},
  "provenance":{"producer":"example-policy-engine","semantic_profile":"TSMM decision-resolution semantics"}
}
